<?xml version="1.0" ?>
<!DOCTYPE CompetencyManagerRules SYSTEM "CompetencyManagerRules.dtd">

<CompetencyManagerRules>

	
	<Rule>
		
		<MindAction Name="askForID">
				<Parameter No="1" Value="*" />				
		</MindAction>		
		
		<CompetencyExecutionPlan>
			<Competency ID="1" Type="TTS">
			 <CompetencyParameter Name="text" Value="Hello my Name is Sarah. Who are you? I cannot tell. But you can send me an SMS to tell me." />
			</Competency>
		</CompetencyExecutionPlan>

	</Rule>
	
	<Rule>
	
		<MindAction Name="welcomeUnknown">
				<Parameter No="1" Value="*" />
		</MindAction>			
		<CompetencyExecutionPlan>
			<Competency ID="1" Type="TTS">
			 <CompetencyParameter Name="text" Value="Howdy $parameter1. I cannot talk with you. I'm busy. I'm waiting for someone and it's not you. Please go away now and leave me to my important task. " />
			</Competency>
		</CompetencyExecutionPlan>

	</Rule>
	
	<Rule>

		<MindAction Name="welcomeGuest">
				<Parameter No="1" Value="*" />
		</MindAction>			
		<CompetencyExecutionPlan>
			<Competency ID="1" Type="TTS">
			 <CompetencyParameter Name="text" Value="Nice to meet you $parameter1. I was expecting you." />
			</Competency>
		</CompetencyExecutionPlan>

	</Rule>
	
	<Rule>

		<MindAction Name="offerDirections">
				<Parameter No="1" Value="*" />
		</MindAction>			
		<CompetencyExecutionPlan>
			<Competency ID="1" Type="TTS">
			 <CompetencyParameter Name="text" Value="Do you want me to direct you to the lab?" />
			</Competency>
			<Competency ID="2" Type="EmysAskBinaryQuestion" Dependency="1">
			 <CompetencyParameter Name="choice1" Value="yes" />
			 <CompetencyParameter Name="choice2" Value="no" />
			 <CompetencyParameter Name="question" Value="offerDirections" />
			 <CompetencyParameter Name="person" Value="$parameter1" />			 
			</Competency>
		</CompetencyExecutionPlan>
	</Rule>

	<Rule>

		<MindAction Name="giveDirections">
				<Parameter No="1" Value="*" />
		</MindAction>	
		<CompetencyExecutionPlan>
			<Competency ID="1" Type="TTS">
			 <CompetencyParameter Name="text" Value="The lab number is 2 22. It is on the second corridor. Go up the stairs to the second floor, turn left, follow the corridor and turn left again at the next junction. The lab will be in the corridor to your left." />
			</Competency>
		</CompetencyExecutionPlan>

	</Rule>
	
	<Rule>

		<MindAction Name="giveNoDirections">
				<Parameter No="1" Value="*" />
		</MindAction>			
		<CompetencyExecutionPlan>
			<Competency ID="1" Type="TTS">
			 <CompetencyParameter Name="text" Value="Very well, I guess you have been here before." />
			</Competency>
		</CompetencyExecutionPlan>

	</Rule>
	

	
	<Rule>

		<MindAction Name="askMigrateToPhone">
				<Parameter No="1" Value="*" />
		</MindAction>			
		<CompetencyExecutionPlan>
			<Competency ID="1" Type="TTS">
			 <CompetencyParameter Name="text" Value="Do you want me to migrate to your phone and show you the way?" />
			</Competency>
			<Competency ID="2" Type="EmysAskBinaryQuestion" Dependency="1">
			 <CompetencyParameter Name="choice1" Value="yes" />
			 <CompetencyParameter Name="choice2" Value="no" />
			 <CompetencyParameter Name="question" Value="askMigrateToPhone" />
			 <CompetencyParameter Name="person" Value="$parameter1" />			 
			</Competency>
		</CompetencyExecutionPlan>
		
	</Rule>

	<Rule>

		<MindAction Name="migrate">
				<Parameter No="1" Value="Phone" />
		</MindAction>			
		<CompetencyExecutionPlan>
			<Competency ID="1" Type="TTS">
			 <CompetencyParameter Name="text" Value="I'm transferring over to your phone now. Watch This." />
			</Competency>
			<Competency ID="2" Type="Migration" Dependency="1">
			 <CompetencyParameter Name="DeviceName" Value="Phone" />
			</Competency>
		</CompetencyExecutionPlan>
	
	</Rule>
	
	<Rule>
		
		<MindAction Name="migrate">
			<Parameter No="1" Value="Robot" />
		</MindAction>			
		<CompetencyExecutionPlan>
			<Competency ID="1" Type="TTS">
			 <CompetencyParameter Name="text" Value="OK. I'm going home to my robot body. See you there in a minute." />
			</Competency>
			<Competency ID="2" Type="Migration" Dependency="1">
			 <CompetencyParameter Name="DeviceName" Value="Robot" />
			</Competency>
		</CompetencyExecutionPlan>
		
	</Rule>

	<Rule>
		
		<MindAction Name="wozTalk">
			<Parameter No="1" Value="*" />
		</MindAction>			
		<CompetencyExecutionPlan>
			<Competency ID="1" Type="VirtualEmys">
			  <CompetencyParameter Name="Command" Value="SetSubtitle" />
			  <CompetencyParameter Name="Subtitle" Value="$parameter1" />
			</Competency>
			<Competency ID="2" Type="SimpleTalk" Dependency="1">
			  <CompetencyParameter Name="text" Value="$parameter1" />
			</Competency>
			<Competency ID="3" Type="VirtualEmys" Dependency="2">
			  <CompetencyParameter Name="Command" Value="RemoveSubtitle" />
			</Competency>
		</CompetencyExecutionPlan>
		
	</Rule>

	<Rule>
		
		<MindAction Name="wozEmotion">
			<Parameter No="1" Value="*" />
		</MindAction>			
		<CompetencyExecutionPlan>
			<Competency ID="1" Type="SimpleAnimation">
			 <CompetencyParameter Name="animation" Value="$parameter1" />
			</Competency>
		</CompetencyExecutionPlan>
		
	</Rule>

	<Rule>
		
		<MindAction Name="wozEmotionNoWait">
			<Parameter No="1" Value="*" />
		</MindAction>			
		<CompetencyExecutionPlan>
			<Competency ID="1" Type="SimpleAnimation">
			 <CompetencyParameter Name="animation" Value="$parameter1" />
			 <CompetencyParameter Name="returnImmediately" Value="true" />
			</Competency>
		</CompetencyExecutionPlan>
		
	</Rule>

	<Rule>
		<MindAction Name="wozQuestion">
			<Parameter No="1" Value="*" />
		</MindAction>			
		<CompetencyExecutionPlan>
			<Competency ID="1" Type="EmysAskQuestion">
			 <CompetencyParameter Name="choice1" Value="$parameter1" />
 			 <CompetencyParameter Name="question" Value="question" />
 			 <CompetencyParameter Name="person" Value="wizard" /> 			 
			</Competency>
		</CompetencyExecutionPlan>		
	</Rule>


	<Rule>	
		<MindAction Name="wozQuestion">
			<Parameter No="1" Value="*" />
			<Parameter No="2" Value="*" />
		</MindAction>			
		<CompetencyExecutionPlan>
			<Competency ID="1" Type="EmysAskQuestion">
			 <CompetencyParameter Name="choice1" Value="$parameter1" />
			 <CompetencyParameter Name="choice2" Value="$parameter2" />
 			 <CompetencyParameter Name="question" Value="question" />
 			 <CompetencyParameter Name="person" Value="wizard" /> 			 
			</Competency>
		</CompetencyExecutionPlan>
	</Rule>

	<Rule>	
		<MindAction Name="wozQuestion">
			<Parameter No="1" Value="*" />
			<Parameter No="2" Value="*" />
			<Parameter No="3" Value="*" />
		</MindAction>			
		<CompetencyExecutionPlan>
			<Competency ID="1" Type="EmysAskQuestion">
			 <CompetencyParameter Name="choice1" Value="$parameter1" />
			 <CompetencyParameter Name="choice2" Value="$parameter2" />
			 <CompetencyParameter Name="choice3" Value="$parameter3" />
 			 <CompetencyParameter Name="question" Value="question" />
 			 <CompetencyParameter Name="person" Value="wizard" /> 			 
			</Competency>
		</CompetencyExecutionPlan>
	</Rule>
	
	<Rule>	
		<MindAction Name="wozQuestion">
			<Parameter No="1" Value="*" />
			<Parameter No="2" Value="*" />
			<Parameter No="3" Value="*" />
			<Parameter No="4" Value="*" />
		</MindAction>			
		<CompetencyExecutionPlan>
			<Competency ID="1" Type="EmysAskQuestion">
			 <CompetencyParameter Name="choice1" Value="$parameter1" />
			 <CompetencyParameter Name="choice2" Value="$parameter2" />
			 <CompetencyParameter Name="choice3" Value="$parameter3" />
			 <CompetencyParameter Name="choice4" Value="$parameter4" />
 			 <CompetencyParameter Name="question" Value="question" />
 			 <CompetencyParameter Name="person" Value="wizard" /> 			 
			</Competency>
		</CompetencyExecutionPlan>
	</Rule>

	<Rule>	
		<MindAction Name="wozCancelQuestion">
		</MindAction>			
		<CompetencyExecutionPlan>
			<Competency ID="1" Type="VirtualEmys">
			 <CompetencyParameter Name="Command" Value="CancelQuestion" />
			</Competency>
		</CompetencyExecutionPlan>
	</Rule>

	<Rule>	
		<MindAction Name="wozSetVisible">
		</MindAction>			
		<CompetencyExecutionPlan>
			<Competency ID="1" Type="VirtualEmys">
			 <CompetencyParameter Name="Command" Value="SetVisible" />
			</Competency>
		</CompetencyExecutionPlan>
	</Rule>

	<Rule>	
		<MindAction Name="wozSetInvisible">
		</MindAction>			
		<CompetencyExecutionPlan>
			<Competency ID="1" Type="VirtualEmys">
			 <CompetencyParameter Name="Command" Value="SetInvisible" />
			</Competency>
		</CompetencyExecutionPlan>
	</Rule>
	
	<Rule>
		
		<MindAction Name="wozGaze">
			<Parameter No="1" Value="*" />
		</MindAction>			
		<CompetencyExecutionPlan>
			<Competency ID="1" Type="EmysGaze">
			 <CompetencyParameter Name="gazeTarget" Value="$parameter1" />
			</Competency>
		</CompetencyExecutionPlan>
		
	</Rule>
	
	<Rule>
		
		<MindAction Name="testbug">
			<Parameter No="1" Value="*" />
		</MindAction>			
		<CompetencyExecutionPlan>
			<Competency ID="1" Type="SimpleAnimation">
			 <CompetencyParameter Name="animation" Value="Anger5" />
			</Competency>
			<Competency ID="2" Type="VirtualEmys">
			 <CompetencyParameter Name="Command" Value="SetVisible" />
			</Competency>
			<Competency ID="3" Type="SimpleAnimation" Dependency = "2">
			 <CompetencyParameter Name="animation" Value="Joy5" />
			</Competency>
		</CompetencyExecutionPlan>
		
	</Rule>	
	
	<Rule>
		
		<MindAction Name="greet">
			<Parameter No="1" Value="*" />
		</MindAction>			
		<CompetencyExecutionPlan>
			<Competency ID="1" Type="TestType7">
			</Competency>
		</CompetencyExecutionPlan>
		
	</Rule>
	
</CompetencyManagerRules>