<?xml version="1.0" ?>
<!DOCTYPE CompetencyManagerRules SYSTEM "CompetencyManagerRules.dtd">

<CompetencyManagerRules>
		<Rule>
		
		<MindAction Name="TestAction">
				<Parameter No="1" Value="test" />
		</MindAction>		
		
		<CompetencyExecutionPlan>
			<Competency ID="1" Type="GretaBMLCreator">
			 <CompetencyParameter Name="BmlOutName" Value="bmlVar" />
			</Competency>

			<Competency ID="2" Type="GretaBMLSender" Dependency="1">
			 <CompetencyParameter Name="BmlInName" Value="bmlVar" />
			</Competency>

		</CompetencyExecutionPlan>
		
	</Rule>
	
</CompetencyManagerRules>